{
  "$schema": "../../schemas/extension.v1.schema.json",
  "schemaVersion": 1,
  "id": "packingproof.qqbot",
  "publisherId": "packingproof",
  "name": "QQ 机器人",
  "summary": "通过 QQ 私聊或群聊按快递单号查询并发送打包录像",
  "description": "连接 QQ 官方机器人与录像主机。\n\n用户可以在私聊中发送快递单号，或在群聊中 @机器人查询并接收打包录像。\n\n文件过大时，可请求录像主机生成适合 QQ 发送的副本",
  "type": "external-adapter",
  "repository": {
    "provider": "github",
    "owner": "PackingProof",
    "name": "PackingProof-QQBot"
  },
  "homepage": "https://github.com/PackingProof/PackingProof-QQBot",
  "license": {
    "spdx": "AGPL-3.0-only",
    "sourceUrl": "https://github.com/PackingProof/PackingProof-QQBot/blob/main/LICENSE"
  },
  "screenshots": [
    {
      "alt": "在 QQ 群中发送快递单号并收到对应的打包录像",
      "sha256": "55590639333b4a1f4f5d9b2d0a8189c130b118bdd7f7d9abd657ddf9a7fc7e37",
      "size": 47997,
      "url": "https://gitee.com/PackingProof/PackingProof-QQBot/raw/73ad4884c45b288d0b4537fd39383eb1b64b6e03/docs/images/qq-group-query.jpg"
    }
  ],
  "categories": ["chatbot", "recording"],
  "releaseSources": [
    {
      "provider": "gitee",
      "owner": "PackingProof",
      "name": "PackingProof-QQBot"
    },
    {
      "provider": "github",
      "owner": "PackingProof",
      "name": "PackingProof-QQBot"
    }
  ]
}
